Link,Occurred,City,State,Country,Shape,Summary,Reported,Media,Explanation
Open,10/18/2023 1:41,Columbia - Fort Meade Area,MD,USA,Egg,"A egg shaped object, glowing with a small contrail, shot through the sky heading Northwest. It seemed at a low altitude",10/18/2023,,
Open,10/17/2023 21:40,Big Bend,TX,USA,Orb,Large orb / crescent light traveled from south to north for a few seconds then appeared to dissipate above our heads.,10/22/2023,,
Open !,10/17/2023 19:39,Not sure,MN,USA,Formation,"Three series of 3 slightly yellow/ white,lights spaced wide apart that then became one bright light, then went back to three..",10/17/2023,,
Open,10/17/2023 19:36,Ladera Ranch,CA,USA,Orb,"1 or 2 glowing orbs above my home that remained stationery for a few hours, then sped off at very high speed",4/22/2024,Y,
Open,10/17/2023 19:15,Tempe,AZ,USA,Orb,Bright dot with aura around it,10/17/2023,,
Open,10/17/2023 19:11,Litchfield Park,AZ,USA,Disk,Circle beam of light hovering above us,10/18/2023,Y,
Open,10/17/2023 19:11,Walnut Grove,GA,USA,Disk,"Upon entering into my driveway, I noticed 3 stationary objects",10/18/2023,Y,
Open,10/17/2023 19:10,Tucson,AZ,USA,Oval,Sitting on deck facing west saw white oval/round light moving slow with a halo around it.,10/17/2023,,
Open,10/17/2023 19:05,Valley center,CA,USA,Sphere,I witnessed a bright white sphere with light surrounding it 360 degrees,10/17/2023,,
Open,10/17/2023 18:30,Phoenix,AZ,USA,Sphere,Bright white ball of light traveling very quickly w/ a slight soft glow of translucent blue light surrounding the bright white sphere,10/17/2023,,
Open,10/17/2023 7:10,Salt Lake City,UT,USA,Unknown,Looks like a weird unscheduled launch from a weird angle for the closest base,10/17/2023,Y,Contrail
Open,10/17/2023 4:15,Amarillo,TX,USA,Light,Three lights fading in and out also moving at high speed.,10/17/2023,Y,
Open,10/17/2023 4:00,Chicago,IL,USA,Circle,I woke up at 4am and went kitchen to get water. I looked out of my window and there was a very bright light that wasn't moving,10/17/2023,Y,Planet/Star?
Open,10/17/2023 2:07,Jacksonville,FL,USA,Oval,Could not see craft - 1st object was red - second object following in same path same size was orange,10/16/2023,,
Open,10/16/2023 21:45,Grayslake,IL,USA,Circle,Rotating copper craft changing brightness every few seconds,10/16/2023,,Satellite?
Open,10/16/2023 20:26,Round Rock/Cedar Park,TX,USA,Orb,"Orbs and then additional orbs ""sprouting"" from one",10/17/2023,Y,
Open,10/16/2023 20:10,Loveland,CO,USA,Orb,"Bright orb spotted moving across sky over Loveland, CO",10/19/2023,Y,
Open,10/16/2023 19:00,,-,USA,Cube,"Saw odd colors and geometric shapes from 30,000 feet in an airplane",10/16/2023,Y,
Open,10/16/2023 13:25,Pasadena,CA,USA,Rectangle,Rectangular white object suspended in the sky over Pasadena.,10/17/2023,,
Open !,10/16/2023 8:58,,AR,USA,Cylinder,Lower altitude flyby of Allegiant Flight 3145 on a 180 flight trajectory.,10/16/2023,,
Open,10/16/2023 7:52,Epes (near),AL,USA,Unknown,At or about 7:52 while traveling northeast on the interstate; I noticed bright shining thing probably 2-3 miles in the sky .,10/17/2023,,
Open,10/15/2023 23:34,Indianapolis,IN,USA,Formation,Lights behind clouds in 2 separate circular forms . Slowly rotating in the sky behind clouds,10/15/2023,Y,Searchlight
Open,10/15/2023 23:13,North Arlington,NJ,USA,Circle,I have a home security camera placed in my bedroom window I have 2 short video clips of a circle shape object with different colors,10/19/2023,Y,Aircraft
Open,10/15/2023 22:50,,CA,USA,Teardrop,it looks like a red and blue and white lights with red,10/15/2023,,
Open,10/15/2023 22:00,Cleveland,NM,USA,Circle,This lights comes down from the sky. They move around the sky and disappear then come back,10/16/2023,Y,
Open,10/15/2023 21:35,Indianapolis,IN,USA,Formation,I got it on video it’s was lights moving and gliding like sprites,10/15/2023,,
Open,10/15/2023 21:28,St clairsville,OH,USA,Orb,There was green objects going at insane speeds going side to side up and down like nothing I’ve ever saw before.,10/15/2023,Y,
Open,10/15/2023 21:05,Orlando,FL,USA,Unknown,3 silent gray deltoid figures left in a flash of light disintegrating,10/16/2023,,
Open,10/15/2023 21:01,Arvada,CO,USA,Triangle,Dark Triangle Shaped object three dim white lights on each tip,10/16/2023,,
Open,10/15/2023 20:46,Waxhaw,NC,USA,Light,Camera caught a strange what appears to be a beam from the sky,10/19/2023,Y,Insect
Open,10/15/2023 7:23,Ione,CA,USA,Orb,As I was driving home from work I noticed a green or light blue colored light/orb in the sky not a drone.rapid movement high altitude.,10/15/2023,,
Open,10/15/2023 5:51,"Hollywood, Los Angeles",CA,USA,Circle,I thought it was a star but appeared so large the the stars near it looked tiny i go my phone & zoomed in looked like a light rotating,10/15/2023,Y,Planet/Star
Open,10/15/2023 2:00,Idaho falls,ID,USA,Light,"Bright light high in the sky, to the west, about 30 deg up from the horizon.",10/15/2023,,Balloon?
Open,10/14/2023 22:30,Kearney,MO,USA,Changing,An object in what look like mist and bobbing light,10/25/2023,Y,
Open,10/14/2023 22:00,Richardson,TX,USA,Chevron,"Large, silent v shape, translucent but had luminescence flying and appeared twice",10/14/2023,,
Open,10/14/2023 22:00,Mt. Pleasant,IA,USA,Light,"There was 1 light then it separated into 4 lights, then it went back together.",10/14/2023,Y,Searchlight
Open,10/14/2023 21:45,Quartzite,AZ,USA,Changing,2 lights were orbiting each other then one stopped moving in the same spot as Jupiter rises.,10/16/2023,,
Open,10/14/2023 20:25,TAYLOR,MI,USA,Unknown,Looking out back door and saw 2 white oblong shaped objects close to each other.,10/15/2023,,
Open,10/14/2023 20:15,Tewksbury,MA,USA,Rectangle,Bright Rectangular objects in sky,10/19/2023,,
Open,10/14/2023 20:00,Oswego,IL,USA,Orb,"It may have been four lights from one object, the lights seemed to travel along a set path",10/14/2023,,Searchlight
Open,10/14/2023 19:30,Indianapolis,IN,USA,Orb,At first I saw a black drone. Then I realized it was comprised of multiple black orbs.,10/14/2023,,
Open,10/14/2023 14:30,Spring Hill,FL,USA,Oval,I was filming the eclipse through my telescope and saw two oval objects,10/14/2023,Y,
Open,10/14/2023 12:00,Pflugerville,TX,USA,Cube,Zoomed in on the images after eclipse was over and noticed the anomaly on photos of phone..,10/14/2023,Y,Camera Anomaly
Open,10/14/2023 10:09,Lake Havasu city,AZ,USA,Disk,"Snapped photo of eclipse, saw this anomaly",10/18/2023,Y,Camera Anomaly
Open,10/14/2023 6:05,Saint Cloud,MN,USA,Sphere,3 of these were hovering and moving by my house. I recorded the object and it got extremely large in a split second and small again.,10/15/2023,Y,Planet/Star?
Open,10/14/2023 5:48,Murphysboro,IL,USA,Unknown,Peculiar event with a lot going on.,10/14/2023,Y,
Open !,10/14/2023 4:00,Austin,TX,USA,Unknown,"Perfectly silent craft drifts to the east, bright light seen, object came to a standstill several times",11/3/2023,,
Open,10/14/2023 2:00,Newcomb,NY,USA,Cylinder,Middle of the adk mountains with what looked like people with head lamps or the dome had light,10/22/2023,,
Open,10/14/2023 1:59,New Brighton,PA,USA,Unknown,I found this photo on my trail camera its a squence of 3 photos this is 1.My Am and Pm are reversed on my camera,10/20/2023,Y,Camera Anomaly?
Open,10/13/2023 21:25,Columbia,TN,USA,Light,I have a video but it's basically lights going back and forth and around and around in a circle.,10/13/2023,Y,Searchlight
Open,10/13/2023 20:45,Greenville,TX,USA,Oval,"A mysterious light moving in the sky, the light appears to be surrounded by something “cloudy” or “smoky.”",10/14/2023,Y,Rocket?
Open,10/13/2023 20:42,Hays,KS,USA,Other,I saw multiple ufos.,10/13/2023,,
Open,10/13/2023 20:30,Austin,TX,USA,Circle,Bright light in sky with aura around it moving very fast and leaves o rings after idling then accelerating to high speed,10/14/2023,Y,Rocket?
Open,10/13/2023 20:03,Hasbrouck Heights,NJ,USA,Circle,Bright circular light fairy close. Took a photo out of curiosity as it was stationary and had no sound,10/23/2023,Y,
Open,10/13/2023 20:00,Cedar Park,TX,USA,Cigar,Saw bright bar of light in sky,10/14/2023,,Rocket
Open,10/13/2023 19:42,Spotswood,NJ,USA,Light,Swarm of 12-15 light orange lights flying slowly towards the southwest,10/13/2023,,
Open,10/13/2023 19:40,TurnerTown/Overton,TX,USA,Light,Westbound 64 light,10/13/2023,,Rocket
Open,10/13/2023 19:36,Sandia,TX,USA,Light,Moving object with bright light which emitted a vapor ring that emanated in front of the moving object.,10/13/2023,,Reflection
Open,10/13/2023 19:36,Hastings OK,OK,USA,Disk,Strange object that vanished,10/13/2023,,Rocket
Open,10/13/2023 19:36,Noble,OK,USA,Other,I took a video,10/13/2023,Y,Rocket
Open,10/13/2023 19:35,Richardson,TX,USA,Circle,"Glowing ball, blows smoke rings in front of its path",10/14/2023,Y,Rocket
Open,10/13/2023 19:35,Dallas,TX,USA,Orb,Orb moved slowly and emitted a circle,10/14/2023,Y,Rocket
Open,10/13/2023 19:35,Sour Lake,TX,USA,Light,Unusual bright light seeming to be going south emitted a blast ring then disappeared.,10/13/2023,,Rocket
Open,10/13/2023 19:35,Wichita,KS,USA,Light,A bright light seemed to be descending with a plume constantly around it and then a large halo plume emitted before heading eastward.,10/13/2023,,Rocket
Open,10/13/2023 19:35,Irving,TX,USA,Oval,UFO sighting,10/13/2023,,Rocket
Open,10/13/2023 19:35,Texarkana,AR,USA,Orb,Light orb,10/13/2023,Y,
Open,10/13/2023 19:35,Clifton,TX,USA,Light,"On cloudless night, a ball of diffused light passed from west to east. It made no noise",10/13/2023,Y,Rocket?
Open,10/13/2023 19:35,Perrin,TX,USA,Light,"Bright, fuzzy, light traveling from west to east at a high rate of speed",10/13/2023,Y,Rocket
Open,10/13/2023 19:35,Fort Worth,TX,USA,Orb,"Believed to see light reflecting off fixed plane, began traversing across sky, grew brighter, did something very odd.",10/13/2023,,Rocket?
Open,10/13/2023 19:35,Eureka Springs,AR,USA,Orb,Bright light emitted plume before disappearing,10/14/2023,Y,Rocket
Open,10/13/2023 19:35,round rock,TX,USA,Circle,Large round circle ball of light that shot circles of gas forward while also moving forward and split into 2 crafts it was also silent.,10/14/2023,Y,Rocket
Open,10/13/2023 19:34,Austin,TX,USA,Changing,Who is moving from west to east very low in the sky seems like a cloud with a bright light inside of it. Hit pause for a moment,10/13/2023,,Rocket
Open,10/13/2023 19:32,Austin,TX,USA,Orb,Orb lifght with cloud like surrounding,10/13/2023,Y,Rocket
Open,10/13/2023 19:32,Pflugerville,TX,USA,Circle,Bright circle releasing something in the air.,10/13/2023,,Rocket
Open,10/13/2023 19:30,Smithdale MS,MS,USA,Circle,"Seen in southern sky, it looked like a ball of energy, almost like the moon behind a cloud. The skies were clear.",10/13/2023,Y,Rocket
Open,10/13/2023 19:30,Paden,OK,USA,Light,"Large, yellowish-white orb, traveling northeast to southwest flew near my farm emitting some sort of ""material"" and vanished.",10/13/2023,,Rocket
Open,10/13/2023 19:30,Dallas,TX,USA,Light,It was a light on sky as seen in video it was like sphere,10/13/2023,Y,Rocket
Open !,10/13/2023 19:03,Green Valley,AZ,USA,Orb,A very bright glowing white orb passed near our house and jetted into infinity without making a sound.,10/17/2023,,
Open !,10/13/2023 19:00,"Sonoita, Arizona",AZ,USA,Light,"Bright light lasting for 5 to 6 total Mississippi seconds flew east to west through clouds, and disappeared, ridiculous speed no sound.",10/13/2023,,
Open,10/13/2023 14:21,Palm Bay,FL,USA,Disk,He was early in the morning walking my dog and knew the rocket was going off SpaceX and I looked up and there was UFO at red green and,1/2/2024,,
Open,10/13/2023 8:15,Groton,CT,USA,Oval,"Saw stationary object in the sky potentially over Groton, Ct (navel base)",10/13/2023,,
Open,10/13/2023 7:00,McLean,VA,USA,Light,A light source changing size continuously seen.,10/13/2023,Y,
Open,10/13/2023 6:30,Hughesville,MD,USA,Other,"As I was driving while passing a neighborhood entrance where the view of the sky was no blocked i saw it, it was emitting light.",10/13/2023,Y,
Open,10/13/2023 6:25,Benson,VT,USA,Diamond,"Green light flash in the sky approx 100 yards from intersection on a diamond-esque, dark colored shape low in the sky, vanished",10/13/2023,,
Open,10/13/2023 6:11,North Wilkesboro,NC,USA,Star,"I took multiple videos of these Star like objects, the enclosed video shows 2 of them meeting at the little dipper",10/13/2023,,
Open,10/13/2023 6:08,Knoxville,TN,USA,Circle,Flashing lights seen on a craft hovering above the neighborhood,10/13/2023,,
Open,10/13/2023 4:22,Medical Lake,WA,USA,Sphere,Looking towards the east we saw an orange thing floating. It then started moving south out of view.,10/13/2023,,
Open,10/13/2023 2:15,Everett,WA,USA,Orb,"Overhead sighting of 3 “orbs” flying in a rapid, silent, loose formation from the NW to the SE in the early AM hours of 10/13/23.",10/13/2023,Y,
Open,10/12/2023 23:46,"Parsippany-Troy Hills, Pyramid Mountain, Taylortown",NJ,USA,Light,"Red orb could be seen getting brighter before ""zipping"" north-east, left a green trail coming out of the red orb.",10/14/2023,,
Open !,10/12/2023 23:40,Carrollton,TX,USA,Unknown,A blinding light shown down on my house even though there was no storm/ rain event. The light was blinding and illuminated my yard,10/12/2023,,
Open,10/12/2023 21:48,Port Arthur,TX,USA,Orb,Glowing sphere,10/12/2023,,
Open !,10/12/2023 20:35,Waynesfield,OH,USA,Triangle,"Huge, triangular craft, bright strobing lights down each side",10/12/2023,,
Open,10/12/2023 20:30,Centreville,MD,USA,Light,"Saw a distant light moving slowly and then rapidly accelerated horizontally, eventually disappearing.",10/23/2023,,
Open,10/12/2023 20:30,Green Valley,AZ,USA,Circle,Light fading in and out,10/13/2023,,
Open,10/12/2023 19:59,Yonkers,NY,USA,Circle,"I recorded 3. One moved too quickly to catch, but I think one other appears very briefly in the lower left corner of the 3rd (the longe",10/13/2023,Y,
Open,10/12/2023 19:55,Mount Vernon,WA,USA,Light,"Bright Orange light in the sky, very high up, probably 25-35,000ft. It appeared suddenly, rapidly flew around, then faded red till gone",10/13/2023,,
Open,10/12/2023 19:43,San Pedro,CA,USA,Triangle,Silent Dim Triangle over Los Angeles,10/12/2023,Y,
Open,10/12/2023 19:33,Decatur,IL,USA,Circle,Two white circle shapes blinking steadily,10/12/2023,Y,
Open,10/12/2023 18:44,Seattle,WA,USA,Cylinder,See attached photos,10/13/2023,Y,
Open,10/12/2023 6:30,Felton,PA,USA,Light,Bright blue lights with a flashing red light,10/22/2023,,
Open,10/12/2023 2:29,Finger,TN,USA,Orb,Saw strange round lights from car,11/12/2023,Y,
Open,10/11/2023 21:21,Bellingham,WA,USA,Circle,I saw a circular object that looked to be on fire. It was disc shaped and was moving slowly in a northwestward direction.,10/11/2023,Y,
Open,10/11/2023 21:14,Ridgefield,WA,USA,Circle,Purple backlit light in clouds,10/13/2023,Y,
Open,10/11/2023 20:30,Locust Grove,GA,USA,Triangle,I noticed this object with bright light in the sky for several nights. It was lower than a star and the object had large lights & small,10/23/2023,Y,Planet/Star?
Open,10/11/2023 20:29,Oak Ridge,TN,USA,Fireball,Red orb rises straight up then disappears,10/11/2023,,
Open,10/11/2023 20:07,Gastonia,NC,USA,Oval,Tumbling large red circular shape that was changing shape and moving NNW and didn’t appear to be too far above the ground,10/12/2023,Y,
Open,10/11/2023 19:59,Plymouth,MA,USA,Star,North lights going upward around 50 ft from one another fast and in a straight row,10/11/2023,,
Open,10/11/2023 19:22,The Woodlands,TX,USA,Changing,"Red, green and white blinking circle moving eratically vertically to the horizon.",10/12/2023,,
Open,10/11/2023 18:36,Hot Springs,AR,USA,Cigar,"No visible wings, moving slow and odd sound",3/4/2024,,Drone?
Open,10/11/2023 18:34,Canastota,NY,USA,Disk,One disk object floating forward,10/11/2023,Y,Insect?
Open,10/11/2023 15:27,San Jose,CA,USA,Disk,This video shows a ship cloaking and shows the bubbles unseen by naked eyes.,12/7/2023,Y,Aircraft?
Open,10/11/2023 14:15,Baltimore,MD,USA,Orb,I saw this orb or something like flying very fast above my head.,10/11/2023,,
Open,10/11/2023 14:15,Moore,OK,USA,Other,"Saw a bright blue light that looked like a star, thought it was weird so I pointed it out.",10/12/2023,,
Open,10/11/2023 4:36,Sacramento,CA,USA,Disk,Disk shaped object with light,10/11/2023,Y,
Open,10/11/2023 1:19,Aurora,CO,USA,Light,Moving,10/11/2023,Y,Insect
Open,10/10/2023 23:48,Fredericksburg,VA,USA,Orb,White light flying across sky at a high rate of speed. No noise.,10/10/2023,,
Open,10/10/2023 23:15,South Dennis,MA,USA,Orb,"Out on deck, looking at sky. I noticed a glowing red orb that also looked like it had smaller, flashing red lights around center.",10/10/2023,,
Open,10/10/2023 23:12,Buffalo Valley,OK,USA,Rectangle,Shiny craft with two gray squares towards both ends not moving,10/11/2023,Y,
Open,10/10/2023 22:52,Los Angeles,CA,USA,Disk,"On October 10, 2023, near Calabasas Peak, pulsating blue light, observed a silent, disc-shaped object with a pulsating blue light",10/17/2023,Y,
Open,10/10/2023 22:32,Brandywine,MD,USA,Orb,Similar to one I reported on 11/19/22,10/11/2023,Y,Planet/Star
Open,10/10/2023 22:00,South Lake Tahoe,CA,USA,Circle,They were on the search for something I don't know they've been happening over today. They come in nightly and they're here all night,10/12/2023,Y,
Open,10/10/2023 19:55,Plymouth,MA,USA,Light,Saw 20 lights inline over course of 4-5 minutes. Some stopped and made erratic maneuvers,10/10/2023,,
Open,10/10/2023 18:55,Marietta,OH,USA,Cigar,My wife and I saw lights in a craft coming out of a Mexican restaurant in Marietta Ohio.,10/11/2023,,
Open,10/10/2023 18:20,South Amherst,OH,USA,Orb,An unusually bright orb of light floated stationary in the sky and darted away in an instant at an incredible speed,10/10/2023,,
Open,10/10/2023 18:15,Homeworth (south of CX),OH,USA,Other,"Very large dk grey object in sky north of my position approximately 1-1.5 miles N. Insight 10 sec, pulled onto side rd to get view gone",10/10/2023,,
Open,10/10/2023 9:00,Fort Wayne,IN,USA,Disk,I saw a shiny metallic disc. It traveled away from me.,10/18/2023,,
Open,10/10/2023 5:44,Ventura,CA,USA,Rectangle,"Very bright objects with 5-6 non-blinking lights on each, flying side by side usually see only one",10/10/2023,,
Open,10/10/2023 2:52,Port Orchard,WA,USA,Orb,Floating green orb,10/11/2023,Y,
Open,10/9/2023 22:10,Maricopa,AZ,USA,Light,Sitting on patio and saw 2 very diffuse orbs flying together shifting very fast and then disappearing,10/9/2023,,
Open,10/9/2023 20:53,New Braunfels,WI,USA,Orb,A reddish orb light was traveling silently from the East horizon to the South West horizon under the cloud cover in about two minutes.,10/14/2023,Y,
Open,10/9/2023 20:09,Hinsdale,IL,USA,Circle,Multiple bright lights moving in a line then erratically,10/9/2023,Y,Starlink
Open,10/9/2023 20:00,Bainbridge Island,WA,USA,Star,Saw a bright star zig zagging like a 'z' super quick. Couldn't tell how far away. Had girlfriend look at it and she saw it zig zag.,10/14/2023,,Drone
Open,10/9/2023 19:02,Albuquerque,NM,USA,Circle,Remained in a circle area turning different colors. Then left.,10/19/2023,,
Open,10/9/2023 14:38,Broken arrow,OK,USA,Triangle,Standing inside the Arkansas River taking pictures seen a triangular craft hovering above,10/9/2023,Y,
Open,10/9/2023 7:30,Midvale,UT,USA,Light,Streak of light heading down. 4 days later streak of light heading up toward 3 red lights in triangle formation.,10/13/2023,Y,Contrail
Open,10/9/2023 6:40,Salt Lake City,UT,USA,Light,I have been spotting a round light around 6:20-6:50 on my morning walk to work for about two weeks now.,10/9/2023,Y,Planet/Star?
Open,10/9/2023 4:30,Manchester,NJ,USA,Circle,Saw a large circular object dark orange to red in color flying across the sky from north to south,10/11/2023,,
Open !,10/9/2023 3:30,Idaho Falls,ID,USA,Triangle,"Orange lights in the sky with smooth but random movement that joined in formation to form a triangle, then accelerated away from us.",10/9/2023,,
Open,10/9/2023 3:25,Watauga,TX,USA,Circle,It looked like a strange balloon,10/9/2023,,
Open,10/9/2023 0:22,Hollywood,CA,USA,Triangle,Grey shaped craft no lights flying sideways,10/9/2023,,
Open,10/8/2023 23:18,Wake Forest,NC,USA,Circle,Saw 3 circles of light,10/8/2023,Y,
Open,10/8/2023 21:59,Suffolk,VA,USA,Formation,Four lights flew in formation very fast across sky in diamond formation and then changed formation,10/10/2023,,
Open,10/8/2023 21:05,Gurnee,IL,USA,Light,It was very high in the sky and moved at unbelievable speed.,10/14/2023,,
Open,10/8/2023 19:40,Guntersville,AL,USA,Orb,Reflective Orb,10/10/2023,Y,
Open !,10/8/2023 19:37,Powell Butte,OR,USA,Disk,Large disk,10/12/2023,,
Open,10/8/2023 19:30,Parsippany,NJ,USA,Unknown,Unknown light seen in sky,11/10/2023,Y,
Open,10/8/2023 19:15,Ridgefield (fairgrounds area),WA,USA,Orb,Witnessed an orb (round ball of light} paralleling a commercial flight. Both at different levels and at different speeds.,10/9/2023,,
Open,10/8/2023 18:00,Greenwich,NY,USA,Fireball,My girlfriend and I witnessed 3 or more lights chasing each other around in random patterns before disappearing over the mountains,10/8/2023,,
Open,10/8/2023 18:00,Wichita,KS,USA,Orb,"15-20 clear, metallic orbs gathered at tree line, pulsed light in unison, left together, totally silent and disappeared.",10/14/2023,Y,
Open,10/8/2023 17:00,,CA,USA,Changing,"UFO Spawned, Moved Slowly, Disappeared",10/9/2023,Y,Balloon?
Open,10/8/2023 12:31,Littleton,CO,USA,Oval,"Black object moving south, then north minutes later.",10/10/2023,Y,
Open,10/8/2023 10:31,KANSAS CITY,MO,USA,Changing,"I observed a black object appearing to rotate clockwise without sound as it moved West to East, reflecting sunlight periodically.",10/8/2023,Y,
Open,10/8/2023 10:07,El Cajon,CA,USA,Formation,"16 Shiny Objects Above El Cajon, CA",12/11/2023,Y,
Open,10/7/2023 23:00,Metro Atlanta,GA,USA,Light,Saw a bluish green gumdrop shaped object flying probably around 1000 feet. Flew off at an incredible speed west towards the horizon,10/7/2023,,
Open,10/7/2023 22:00,Waterloo,IL,USA,Light,A bright white light shining through the trees not moving then disappeared,11/15/2023,,
Open !,10/7/2023 21:10,Springfield,OR,USA,Chevron,12 or more dim lights in a perfect chevron or boomerang shape,10/8/2023,,
Open,10/7/2023 21:00,Waldorf,MD,USA,Changing,"Bright light then it had small ""stems"" coming from it like a 4 legged spider.",10/7/2023,Y,
Open,10/7/2023 20:20,Peoria,IL,USA,Light,Multiple lights going above clouds at various patterns and speeds,10/7/2023,,Searchlight?
Open,10/7/2023 17:12,Denver,CO,USA,Orb,Multiple Orbs,10/9/2023,Y,
Open,10/7/2023 4:06,ellijay ga,GA,USA,Circle,one large extremely bright circular object with three circular colored lights located across the top,10/7/2023,,
Open,10/7/2023 4:00,Enid,OK,USA,Changing,Orbs of 1-4 lights that were moving unnaturally in the sky.,10/7/2023,Y,
Open,10/6/2023 23:30,Luray,VA,USA,Light,2 large lights and shooting lights,10/10/2023,Y,
Open !,10/6/2023 23:03,Brighton,MO,USA,Triangle,Three brilliantly white Lights hovering in the sky,10/10/2023,,
Open,10/6/2023 20:30,Phoenix,AZ,USA,Orb,Seen a white orb in the sky while taking my dogs outside,2/25/2024,Y,
Open,10/6/2023 12:05,Grand rapids,MI,USA,Cylinder,Cylinder above clouds going against the wind,10/6/2023,,
Open,10/6/2023 8:45,Chino Valley,AZ,USA,Changing,"Chrome shape changing, stationary",10/6/2023,,
Open,10/6/2023 2:34,Hollywood,CA,USA,Unknown,Formation of light that is hovering and moving slowly twinkling a bright lights of colors of lights other forms of light splitting off,10/6/2023,Y,
Open,10/6/2023 2:00,Madras,OR,USA,Flash,Bright flashing lights,10/6/2023,Y,
Open,10/6/2023 1:00,Sutton,WV,USA,Light,"Bright lights moving around, could see glowing from going above and through our clouds",10/7/2023,,
Open !,10/5/2023 23:00,Chicago,IL,USA,Light,Lights maneuvering rapidly at extreme altitude,10/12/2023,,
Open !,10/5/2023 22:31,Parker,CO,USA,Cylinder,"It was orange object it was massive, it looked similar to a plane but definitely not a plane, it had a giant sphere in the middle.",10/6/2023,,
Open !,10/5/2023 22:30,Chattanooga,TN,USA,Triangle,Triangle shaped object glowing green along the edges sighted for approx 15sec before vision being blocked by buildings.,10/18/2023,,
Open,10/5/2023 21:58,Biddeford Maine,ME,USA,Circle,White light emitted it was small it was fast and left no chem trail and it had disappeared,10/8/2023,,
Open,10/5/2023 21:45,Colorado Springs 80917,CO,USA,Triangle,Spotted 3 red lights in the shape of triangle,10/5/2023,,
Open,10/5/2023 20:06,Topeka,KS,USA,Chevron,"Somewhat low to the ground, silent, black, with many reflective points.",10/5/2023,,
Open !,10/5/2023 20:00,Bridgeport,IL,USA,Disk,Large apparently disk shipped object moving in circular motion about 75-150 feet in the air.,10/6/2023,,
Open,10/5/2023 19:43,Gatlinburg,TN,USA,Flash,ufo's were seen while taking picture of skybridge,10/23/2023,Y,Camera Anomaly
Open,10/5/2023 19:05,Swanton,CA,USA,Triangle,Saw jet chasing object,10/5/2023,,
Open,10/5/2023 18:53,Avon Park,FL,USA,Light,Fading white light,10/6/2023,,
Open,10/5/2023 17:51,White Plains,NY,USA,Chevron,2 objects in the sky (stationary),10/5/2023,Y,
Open,10/5/2023 17:35,Lawrence,MA,USA,Orb,Bright silver orb very high,10/5/2023,,
Open,10/5/2023 12:20,Shippensburg,PA,USA,Circle,"Middle of the day, Half translucent disk flew over driveway and then vanished.",4/9/2024,,
Open,10/5/2023 11:31,lawrence,KS,USA,Light,6 lights flying west to east then 2 lights split off and went in a different direction,10/5/2023,,
Open !,10/5/2023 11:25,Grand Canyon,AZ,USA,Cigar,White cigar shaped traveling from north east to southwest straight line absolutely no sound,10/5/2023,,
