Link,Occurred,City,State,Country,Shape,Summary,Reported,Media,Explanation
Open,1/3/2024 14:00,Covington,OH,USA,Cigar,"Spotted an object in the sky during afternoon walk, Bright silver elongated body with a blue mirrored dome on the bottom it.",1/9/2024,Y,
Open,1/3/2024 2:30,Marysville,WA,USA,Triangle,Large object 200 yards away hovering above the trees,1/4/2024,,
Open,1/3/2024 0:16,Elizabeth,NJ,USA,Orb,Witnessed when looking outside from room,1/2/2024,Y,Planet/Star
Open !,1/2/2024 22:40,Oklahoma City,OK,USA,Oval,Seen the blue white oval object dart right to left from upstairs windows. When I fist witnessed It was stationary.,1/2/2024,,
Open,1/2/2024 20:53,Plymouth,CT,USA,Circle,Ferris wheel shaped craft floating in the South Eastern sky,1/2/2024,Y,
Open !,1/2/2024 18:45,Newtown,CT,USA,Light,"Elongated white light moving slowly or not at all, which then also displayed a series of colored lights in a line as I got closer.",1/2/2024,Y,
Open,1/2/2024 16:42,Richlandtown,PA,USA,Cigar,"Observed a dull, reddish brown colored cigar-shaped object approach from Southwest of Richlandtown, PA and move Northeast",1/5/2024,,
Open,1/1/2024 18:50,Costa Mesa,CA,USA,Orb,3-6 here daily each slightly different . They are bright and right in front for everyone to see.How cone I hear nothing about at all,1/1/2024,Y,
Open,1/1/2024 18:35,Bradenton,FL,USA,Orb,"light came down, move sideways then back upwards until it disappeared",1/5/2024,Y,
Open,1/1/2024 14:59,Manteca,CA,USA,Orb,"Three orbs with plane near by, orbs crisscrossing high speed",1/1/2024,,
Open,1/1/2024 8:10,,MS,USA,Triangle,It was a black triangle with yellow light followed by a white orb,1/1/2024,,
Open,1/1/2024 2:40,Ann Arbor,MI,USA,Orb,A bright orange light hovered motionless shining in my window.,1/2/2024,,
Open,1/1/2024 2:30,Flagler,CO,USA,Orb,Three orbs fluctuating randomly from dim to bright accelerating and slowing down maintains distance from vehicle while traveling.,2/23/2024,,
Open,1/1/2024 0:30,DeWitt,MI,USA,Light,Steady and perfectly horizontal flying bright orange orb,1/24/2024,,
Open,1/1/2024 0:25,West Windsor Township,NJ,USA,Circle,Circular reddish object seen in the sky at around 12.20 AM on 1/1/2024,1/1/2024,Y,
Open,1/1/2024 0:10,Red Bluff,CA,USA,Fireball,8-10 orange fireball-like lights in the western California sky shortly after midnight.,1/1/2024,,
Open,1/1/2024 0:02,Eagle,ID,USA,Star,Five red stars,1/2/2024,,
Open,1/1/2024 0:01,Aurora,CO,USA,Orb,Witnessed a UFO flying,1/1/2024,,
Open,12/31/2023 23:45,Allentown,PA,USA,Disk,Orange light in the sky moving quickly from northwest to Southeast direction,1/2/2024,Y,
Open,12/31/2023 23:00,Wesley Chapel,FL,USA,Light,Bright light,1/1/2024,,Aircraft?
Open,12/31/2023 21:15,Muskego,WI,USA,Orb,"A formation of five focused areas of light, objects-, moving incredibly fast from west to east, and east to west",1/1/2024,,
Open,12/31/2023 20:32,Broadway,NC,USA,Orb,Three orange orbs two in front one trailing behind came directly over our home going generally west to east,1/4/2024,Y,
Open,12/31/2023 20:00,Hartselle,AL,USA,Unknown,"High Altitude Craft, Fires object, Capable of stopping.",1/25/2024,,
Open,12/31/2023 19:53,Lake Wales,FL,USA,Cylinder,Huge Invasion Size Fleet,12/31/2023,Y,
Open,12/31/2023 17:19,Boise,ID,USA,Unknown,"Vertical, black, slow moving/hovering, then quickly moved towards the mountains and lost sight.",12/31/2023,Y,Contrail?
Open,12/31/2023 3:45,Barnegat Township,NJ,USA,Circle,3 glowing objects in eastern sky,12/31/2023,,
Open,12/30/2023 23:45,Collinsville,IL,USA,Diamond,"Black and shaped like a diamond with 5 lights underneath. One blinking, the other 4 solid.",12/31/2023,Y,
Open,12/30/2023 23:31,Boca Raton,FL,USA,Circle,It wavered and seemed way to large to be a drone,12/31/2023,Y,
Open,12/30/2023 20:37,Humptulips,WA,USA,Unknown,Formation of around ten diamond shape lights in the sky,12/31/2023,,
Open,12/30/2023 18:27,Beaverton,OR,USA,Disk,"Unidentified formation of lights seen on walk with a friend. Slowly rotating, & massive. Had a contour like it was a disk on its side.",12/31/2023,,
Open,12/30/2023 9:35,Chicago,IL,USA,Cigar,Very bright rocket with a few objects off to the left,12/30/2023,Y,Contrail?
Open,12/30/2023 7:15,Diamond Bar,CA,USA,Unknown,I was asleep and I heard a low rumbling from outside,12/30/2023,,
Open,12/30/2023 3:30,Baraboo,WI,USA,Orb,Increased UFO activity in Wisconsin,2/16/2024,Y,
Open,12/29/2023 20:45,Alta,IA,USA,Orb,Saw multicolor flashing object staying in place,12/29/2023,,
Open,12/29/2023 19:53,Sterling,IL,USA,Light,"Light was elevated above tree line, brighter than Venus. It disappeared, by reduction, and appearing to reappear 10-15° to the right.",1/3/2024,Y,
Open,12/29/2023 19:25,Missoula,MT,USA,Light,Looked like a string of lights after a rectangular shaped object sort of like a piece of paper angled like you’re looking at it's edge,12/29/2023,Y,
Open,12/28/2023 20:30,Kannapolis,NC,USA,Oval,Oval object with lights moving across the sky. The lights turned off & it became difficult to see it moving.,12/28/2023,,
Open,12/28/2023 20:10,Port St. Lucie,FL,USA,Star,Object moving erratically over rocket launch.,12/29/2023,Y,
Open,12/28/2023 20:10,Casselberry,FL,USA,Changing,Saw two different moving items in the air. Moved under cloud cover.,12/28/2023,,
Open,12/28/2023 20:09,Windermere,FL,USA,Fireball,Multiple burning lights in the sky moving erratically.,12/28/2023,Y,Rocket
Open,12/28/2023 20:08,Merritt Island,FL,USA,Changing,Orb flying fades away,12/28/2023,Y,
Open,12/28/2023 19:52,Byron,GA,USA,Circle,We heard a high frequency noise getting closer and closer we ran to the back door then we look up an see an orb above the trees,12/30/2023,,
Open,12/28/2023 19:00,Tehachapi,CA,USA,Other,3 objects appearing shortly after shooting star event,12/29/2023,,Meteor?
Open,12/27/2023 21:39,Country Club Hills,IL,USA,Changing,"It appeared to be as small as a star but was moving, when I zoomed in it was changing shapes",12/28/2023,Y,Planet/Star
Open,12/27/2023 21:30,Hawthorne,NV,USA,Sphere,Orange/white changing orb,12/28/2023,,
Open,12/27/2023 19:55,Freeburg Township,IL,USA,Light,Several objects that appeared to travel together,12/30/2023,Y,
Open,12/27/2023 10:42,Boston,MA,USA,Changing,Large floating object that appeared to keep changing from one object to four different objects,3/1/2024,Y,Balloon
Open,12/27/2023 7:41,Salt Lake City,UT,USA,Light,Lights don’t set behind eastern mountains in the morning,12/27/2023,Y,Contrail
Open,12/27/2023 3:35,La Jara,CO,USA,Orb,Bright lights that got extremely bright then dimmed out,1/1/2024,,
Open,12/27/2023 3:14,Pullman,WA,USA,Other,Plane like craft flying at light speed,12/27/2023,,
Open !,12/26/2023 20:40,Bunnell,FL,USA,Changing,What appeared as bright star like points of light which would suddenly appear increasing in brightness and then fade away.,12/27/2023,Y,
Open,12/25/2023 17:15,Marblehead,MA,USA,Chevron,"Odd cloud-like chevron shape vibrated, flickered, disappeared",12/25/2023,,
Open,12/25/2023 16:46,Encampment,WY,USA,Cylinder,"white tic-tac shaped dot near the moon stayed still, then disappeared",12/25/2023,Y,
Open,12/25/2023 8:40,Lander,WY,USA,Circle,"Kept lighting up bright then dimming until invisible. Disappeared and reappeared, changed direction a lot and multiple appeared at once",12/26/2023,,
Open,12/25/2023 3:29,Tacoma,WA,USA,Light,"Lights shinning thru upper bedroom, no noise",12/25/2023,Y,
Open,12/24/2023 6:19,Rio Rancho,NM,USA,Circle,Huge tail coming of object traveling south in the sky,12/24/2023,Y,Rocket
Open,12/23/2023 21:53,Lumberton,TX,USA,Orb,Strange orb of light traveling fast in windy conditions.,12/24/2023,Y,
Open,12/23/2023 21:23,Lumberton,TX,USA,Orb,"Lumberton, Texas 9:54pm. Orb light.",12/24/2023,,
Open,12/23/2023 3:20,Brookhaven,NY,USA,Light,"2 very fast/swift moving lights sometimes stationery, moving independently of each other but close together.",12/24/2023,Y,
Open,12/22/2023 5:30,Lexington,NC,USA,Light,My brother and I saw a large reddish-white light over the lake. It increased in brightness and then shot off to the east extremely fast,12/30/2023,,
Open,12/22/2023 2:52,Ridge,MD,USA,Cube,"Multiple crafts moving in all directions observed taking off at very high speed. Square craft with 4 lights, 1 light in each corner.",12/22/2023,,
Open,12/21/2023 19:00,Plantation,FL,USA,Orb,Several orbs fly above my home every night beginning at 6:30-7pm. When it starts to get dark. One hovered right above my roof today,12/20/2023,Y,
Open,12/21/2023 16:35,Newton,MA,USA,Teardrop,"Looked kind of like a whisp of smoke, but it kept its shape for over 25 minutes and moved west faster than we did while in a car.",12/21/2023,Y,Contrail
Open,12/21/2023 16:30,Stratford,CT,USA,Cigar,Long cigar tubular craft with odd propulsion,12/27/2023,Y,Contrail
Open,12/21/2023 4:50,Patchogue,NY,USA,Orb,"Large circular bright white light quickly crosses sky heading for land, with no light trail behind it.",12/21/2023,,
Open,12/20/2023 17:35,Wimberley,TX,USA,Sphere,Spinning object in the sky,1/23/2024,Y,
Open,12/20/2023 17:23,Liberty Township,PA,USA,Oval,"It was chrome oval shaped like an egg, hovering over the farm land then instantly gone",12/21/2023,,
Open,12/20/2023 5:30,Norwalk,OH,USA,Sphere,"Strange orb, light with blue and white lights, hovering in air, looking like it’s separates in the two or three lights back into one",12/20/2023,Y,Planet/Star?
Open !,12/20/2023 3:00,Horace,KS,USA,Unknown,4 white lights of changing intensity resembling stars moving in a portion of the night sky.,12/20/2023,Y,
Open,12/20/2023 2:00,Irmo,SC,USA,Sphere,Stationery ufo object was viewed from the outside of home.,12/20/2023,Y,Planet/Star
Open,12/19/2023 19:00,Nashville,TN,USA,Changing,Looked over at moon as plane went southwest turned to sit down and noticed object flashing in the sky,12/19/2023,,
Open,12/19/2023 19:00,Compton,CA,USA,Circle,Was This The Moon?,12/20/2023,,
Open,12/19/2023 18:24,Hope,ME,USA,Other,"A growing, lengthening shaft of light, that appeared to be going up in the sky (as opposed to the way a meteor moves).",12/20/2023,Y,
Open,12/19/2023 6:53,Early,IA,USA,Unknown,"Changing Lights, odd directional changes",12/19/2023,,Aircraft?
Open,12/19/2023 5:40,Arab,AL,USA,Orb,During my morning work I noticed a white orb moving from west to east.,1/8/2024,Y,
Open,12/18/2023 23:15,Waterloo,IL,USA,Orb,"Viewer was driving home from work. Saw ""3 balls of light"" that fell amazingly fast towards the ground. Sighting lasted <5 seconds.",12/18/2023,,
Open,12/18/2023 23:03,Hudson,FL,USA,Fireball,Red bulb of light that slowly faded to yellow and then to gray before floating there.,12/18/2023,,Flares?
Open,12/18/2023 23:02,Murdock,FL,USA,Sphere,We saw an orangish sphere heading south then turning east.,12/18/2023,,
Open,12/18/2023 20:35,Lebanon,OR,USA,Fireball,"What looked like a fireball was flying calmly, making sudden turns before abruptly disappearing.",12/18/2023,,
Open,12/18/2023 17:15,Bastrop,LA,USA,Egg,2 objects seen. One larger than the other. Appeared to be on intersecting paths but disappeared,12/19/2023,Y,Aircraft
Open,12/18/2023 16:57,Kelso,WA,USA,Disk,It was a black disc and it was moving fast around500 feet in the air.,12/18/2023,Y,
Open,12/18/2023 16:46,Kelso,WA,USA,Disk,It was a black disc and it was moving fast.It was around feet 1000 in the air.,12/20/2023,Y,
Open,12/17/2023 23:00,Amsterdam,ID,USA,Sphere,White sphere darts across highway above car,12/29/2023,,
Open,12/17/2023 20:30,Kiefer,OK,USA,Sphere,Fast flying sphere,5/25/2024,,
Open,12/17/2023 18:57,Vicksburg,MS,USA,Orb,Numerous Orbs high altitude and Fantastic speeds,12/20/2023,Y,
Open,12/17/2023 15:00,Malibu,CA,USA,Chevron,"Boomerang shape craft appeared near bright white light over hill, then disappeared",12/24/2023,,
Open,12/17/2023 5:10,Lynnwood,WA,USA,Triangle,"Seen a huge black boomerang shaped craft flying low from east to west , very little sound",12/17/2023,Y,Aircraft?
Open !,12/16/2023 22:45,Little Rock,AR,USA,Light,5 Lights Moving Rapidly and Changing Direction,1/14/2024,,
Open,12/16/2023 21:42,Fall City,WA,USA,Light,"Bright light moving in random directional order, enough so, that I am motivated to make this report. Video is 3 min 42 sec",12/20/2023,,
Open,12/16/2023 21:08,Tacoma,WA,USA,Orb,5 or 6 linked orbs descending,12/16/2023,,
Open !,12/16/2023 20:50,Ferndale,MI,USA,Sphere,A simple sighting which lasted one second.,12/24/2023,,
Open,12/16/2023 18:15,Cabot,AR,USA,Orb,There was no real pattern in the movements other than being in 2’s.,12/18/2023,Y,Searchlight
Open,12/16/2023 18:00,Harrison,NY,USA,Circle,"I was driving on I-684, I saw it coming towards me so I looked up,It flew over my car, I looked at it, It didn't appear to have wings.",12/17/2023,,
Open,12/16/2023 15:30,Reading,PA,USA,Disk,Definitely caught my attention never seen something like that and flying in that matter plus as metallic glowing some think I’m crazy.,12/16/2023,Y,Bird?
Open,12/16/2023 2:10,Tunkhannock,PA,USA,Flash,I saw a bright blue flash in the Eastern sky. 2 other people saw it as well.,12/16/2023,,Lightning?
Open,12/15/2023 23:45,Capac,MI,USA,Light,"Saw a horseshoe shaped orange light with blue center hovering, it turned 180° on its axis and sped off gaining altitude",12/14/2023,,
Open,12/15/2023 22:00,Sunbright,TN,USA,Changing,This has been happening for a week on a regular basis. It's like nothing I've ever seen and my son in law was USAF stationed on area 52,12/15/2023,,Aircraft
Open,12/15/2023 20:25,Vancouver,WA,USA,Triangle,Three bright orange triangles hovering,12/26/2023,,
Open,12/15/2023 18:05,Clay,NY,USA,Formation,This looked like something out of 'Star Trek',12/20/2023,,
Open,12/15/2023 13:32,Buena Vista,GA,USA,Unknown,Something small is burning; black smoking air,12/17/2023,Y,Aircraft?
Open,12/15/2023 4:11,Parks,AZ,USA,Unknown,A huge see-through dark object appeared in one of my photos during an all-night time lapse I was doing.,12/16/2023,Y,
Open,12/14/2023 23:12,Smiths Creek,MI,USA,Circle,Multicolor craft seen over tree line in front of Michigan home.,12/15/2023,,
Open,12/14/2023 23:05,Batesville,IN,USA,Flash,"No trails eyes couldn’t track seemingly instant, Appearing in/out in complete opposite initial trajectory Curving around while doing so",12/14/2023,Y,
Open,12/14/2023 22:45,Brownstown Charter Township,MI,USA,Unknown,Very bright multi colored pulsating irregular shaped stationary object or light,12/15/2023,Y,Planet/Star
Open,12/14/2023 20:00,Fort Wayne,IN,USA,Orb,Horizontal bight light,12/14/2023,,
Open,12/14/2023 19:50,Myrtle Beach,SC,USA,Fireball,"Observed amber lights dancing in the sky with a green drone, creating a mesmerizing cosmic scene for 5 minutes.",12/14/2023,Y,
Open !,12/14/2023 19:45,Pawleys Island,SC,USA,Triangle,4-5 orange solid lights arranged in a triangle shape,12/14/2023,,
Open,12/14/2023 19:30,Cleveland,VA,USA,Circle,Two lights slowly and smoothly going across the sky. They stayed the same distance apart and the same speed.,3/12/2024,Y,
Open,12/14/2023 19:15,Oxnard,CA,USA,Triangle,Immediately discounted normal aircraft and birds.,12/14/2023,,
Open,12/14/2023 18:00,Harleysville,PA,USA,Sphere,Spherical object moving with bright flashing lights,12/15/2023,Y,
Open,12/14/2023 17:40,Fingerville,SC,USA,Light,"Light was observed, likely stationary then it just extinguished and disappeared",12/17/2023,,
Open,12/14/2023 16:38,Smiths Station,AL,USA,Other,Two fireballs next to each other seeming to not be separated,12/14/2023,Y,Contrail
Open,12/14/2023 7:41,Chicago,IL,USA,Triangle,I saw a line cloud descending from space as far as I could see and I couldn’t recognize the object I assumed it was space junk falling,12/17/2023,Y,Contrail
Open !,12/13/2023 23:00,Greensboro,NC,USA,Orb,"AM sighting of a bright intense light that was hovering over tree line and a PM sighting with 2 crafts of the same ""look"".",12/14/2023,Y,
Open !,12/13/2023 21:20,Warrington,PA,USA,Circle,Saw an object moving silently N then NE in the sky while sitting in my hot tub,3/16/2024,Y,
Open,12/13/2023 15:34,Benson,NC,USA,Disk,Driving up Raleigh road turning right. Right on to Zack's mill road. We saw what look like the planet Saturn. In front of our vehicle.,12/13/2023,,
Open,12/13/2023 4:18,Almont,MI,USA,Light,"Lights in the sky appearing, moving around, and then disappearing",12/14/2023,Y,
Open,12/12/2023 23:33,Oroville,CA,USA,Orb,"During the peak of the Geminid meteor shower, I witnessed an inexplicable sight of stationary orbs dancing in the sky, accompanied by c",3/11/2024,Y,
Open,12/12/2023 23:22,Austin,TX,USA,Orb,Three white lights behind the clouds in triangular formation zipping around in random order,12/12/2023,,
Open,12/12/2023 20:15,West Harrison,IN,USA,Unknown,Fast moving object with glittering trail,12/12/2023,,
Open,12/12/2023 17:06,Ocala,FL,USA,Orb,"Bright, slightly shape shifting orb",12/12/2023,Y,
Open,12/12/2023 5:45,Greenville,MS,USA,Unknown,Two red blinking lights that moved down,12/13/2023,,
Open,12/12/2023 5:30,TATAMY Borough,PA,USA,Circle,Flash then light,12/12/2023,,
Open,12/11/2023 22:36,Alexandria,VA,USA,Sphere,Ball of bright light no noise softball flew over house. It had a tail. Too low tl be comet it was 25ft above the ground,12/13/2023,,
Open,12/11/2023 21:50,Bassett,VA,USA,Circle,"I saw an object move very strangely and I did not notice lights on it and it stopped and then moved, several times.",12/11/2023,Y,
Open,12/11/2023 21:08,Seffner,FL,USA,Triangle,They kept flying zig zag and when I pointed a laser at it it disappears and reappears,12/11/2023,,
Open,12/11/2023 17:45,Sacramento,CA,USA,Changing,Object originally appeared yellow white light in a stick shape then turned to a cross shape and then bluish white blinking lights,12/12/2023,,
Open,12/11/2023 16:45,Morro Bay,CA,USA,Chevron,An object moving through the sky then disappearing,12/11/2023,,
Open,12/11/2023 15:40,Junction City,OR,USA,Orb,I observed a black orb kind of floating around in the sky like a big balloon,12/30/2023,,
Open,12/11/2023 14:14,Litchfield,SC,USA,Unknown,Object flying in many directions,12/11/2023,,
Open,12/11/2023 13:30,Big Bear Lake,CA,USA,Disk,Captured object while taking pictures.,2/20/2024,Y,Reflection
Open,12/11/2023 6:53,San Leandro,CA,USA,Circle,Object traveling very fast doing sprials and zig zagging across the sky,12/11/2023,Y,
Open,12/10/2023 22:50,Paragould,AR,USA,Light,4 bright lights changing up coordinations,12/10/2023,,
Open,12/10/2023 17:14,Scottsdale,AZ,USA,Circle,"Possibly drone, but very high altitude",12/10/2023,Y,Drone?
Open,12/10/2023 3:07,Bath,PA,USA,Fireball,Hovering light orb that repeatedly grew into huge extremely bright fireball/vortex circle and back to orb.,2/13/2024,,
Open,12/9/2023 18:42,Brooklyn,NY,USA,Orb,My son told me there were lights in the sky so I came to look. We saw 9 objects in the sky that disappeared into the clouds.,12/14/2023,Y,Chinese Lantern?
Open,12/9/2023 4:21,Moore Haven,FL,USA,Other,It was like an oval shape but bigger on one side with jagged edges.,12/14/2023,,
Open !,12/8/2023 21:00,Lowell,MI,USA,Disk,Greyish disc with two bright white lights one on each side on front circumference and multi colored red green lights,12/11/2023,Y,
Open,12/8/2023 20:00,Pittsburgh,PA,USA,Chevron,"My husband and I saw and took a video of a very large, chevron shaped craft with a straight row of lights across the back center.",12/8/2023,Y,Balloon?
Open,12/8/2023 19:30,Kingston,TN,USA,Orb,5 second pulsating light low altitude moving steady and fast,12/9/2023,,
Open,12/8/2023 18:01,Kennett Township,PA,USA,Changing,"Object went from a triangle shaped craft in the distance to a massive craft over top of me. The craft didn’t leave, it faded away.",12/30/2023,Y,
Open,12/8/2023 17:30,West Goshen Township,PA,USA,Orb,Amber light. High altitude,12/11/2023,,
Open,12/8/2023 16:40,Fitchburg,MA,USA,Light,Saw a non blinking moving light while driving with a possible smaller light descending from it,12/10/2023,Y,
Open,12/8/2023 4:29,Lawrence,KS,USA,Orb,I’ve seen it before but never recorded it. Pulsing orb with “solar flares” coming from it. Hovers for 15-20 mins then disappears.,12/8/2023,Y,
Open,12/8/2023 4:11,Macomb,MI,USA,Egg,"Caught on Ring camera, invisible to naked eye",12/8/2023,,Camera Anomaly
Open,12/7/2023 23:27,Gig Harbor,WA,USA,Changing,"We spotted a bright blinking object in the sky, it did not appear to be moving but was chain thing colors and pulsating rapidly.",12/7/2023,Y,Planet/Star
Open,12/7/2023 22:12,Honea Path,SC,USA,Disk,"This craft was soundless, seemed to float extremely quickly across sky as if it was water",12/7/2023,,
Open,12/7/2023 21:50,Martinsville,VA,USA,Circle,I viewed the anomaly for about 30 minutes after work and it wasn’t there tonight,12/8/2023,Y,
Open,12/7/2023 20:40,Fairfax,MO,USA,Light,Orange lights seen ascending up from great height,12/8/2023,,
Open,12/7/2023 20:09,Wellfleet,MA,USA,Light,Bright lights changing in intensity,12/8/2023,Y,Boats?
Open,12/7/2023 19:20,Rehoboth Beach,DE,USA,Rectangle,"Took my dog out, noticed some objects in the sky that did not look natural, took a video, immediately said to my son I just saw ET.",12/15/2023,Y,Searchlight
Open,12/7/2023 19:20,Reheboth Beach,DE,USA,Changing,"Took my dog out, noticed some objects in the sky that did not look natural, took a video, immediately said to my son I just saw ET.",12/31/2023,Y,Searchlight
Open,12/7/2023 18:00,Mill Valley,CA,USA,Unknown,Series of green bird shaped ufo's moving in a line quickly accross the sky and disappearing.,12/7/2023,,
Open,12/7/2023 12:33,Memphis,TN,USA,Fireball,There was a light beam in the tree emitting a fireball to the ground,12/8/2023,Y,
Open,12/7/2023 11:05,Columbus,OH,USA,Orb,Another glowing white orb passing over my house,12/7/2023,Y,
Open,12/7/2023 0:00,Roberts,WI,USA,Triangle,Silent craft with 9 flashing lights was seen on a clear night before the clouds interrupted visibility.,12/7/2023,,
Open,12/6/2023 23:50,Pearland,TX,USA,Flash,"Whille stargazing with nitevision monocular, spotted a curious flashing light that had a pattern to it, wasnt a plane, satellite, meteo",12/11/2023,Y,
Open,12/6/2023 19:45,Red Lion,PA,USA,Light,This is the second sighting of this object in the same location. It appears as a white pulsating light,12/6/2023,Y,
Open,12/6/2023 14:00,San Diego,CA,USA,Diamond,Witnessed object that appeared to be rotating and either reflecting light or flashing bright light. Easier to share the video.,12/6/2023,Y,Balloon?
Open,12/6/2023 11:59,Melbourne,FL,USA,Disk,Hovering in place until shooting off southbound and disappearing in a small flash of light.,12/6/2023,Y,
Open,12/6/2023 3:00,Lawler,IA,USA,Light,4 to 5 lights in the sky to the east of New Hampton IA aprox 10 miles roughly above Lawler IA,12/6/2023,,
Open,12/6/2023 1:36,Latexo,TX,USA,Orb,"Standing on front steps of house, looking west. Seen between Mars and horizon.",12/6/2023,,
Open,12/6/2023 0:48,Austin,TX,USA,Chevron,"A light grey craft similar to that of a B2 flying overhead Austin, TX, with no apparent lights and sound.",12/5/2023,,
Open,12/5/2023 17:55,Payson,AZ,USA,Triangle,"I saw a triangular shaped craft while driving through Payson, AZ.",12/6/2023,,
Open,12/5/2023 17:25,Saint Paul,KS,USA,Orb,"This was the earliest I've seen one out. Sun was still setting. It was before 5:30,only star out was Venus or mercury.",12/7/2023,Y,Planet/Star?
Open,12/5/2023 5:36,Santa Monica,CA,USA,Oval,Woke up early and saw strange lights hovering over the ocean. One had lights of different colors.,12/6/2023,Y,
Open,12/5/2023 1:42,Saylorsburg,PA,USA,Circle,I woke up right before this and saw it out my window,1/26/2024,Y,Meteor
Open,12/4/2023 22:45,Corinth,NY,USA,Flash,Mechanical light from Def UAP,12/6/2023,,
Open,12/4/2023 22:00,Dunkirk,IN,USA,Circle,"No sound, projected several bright beams of light from round circle of light into woods onto the ground.",12/6/2023,,
Open,12/4/2023 15:00,Daytona Beach,FL,USA,Sphere,1 spherical vehicle moving south to north with another moving rapidly back and forth,5/30/2024,Y,Bird?
Open !,12/4/2023 1:00,Lorain,OH,USA,Sphere,"A Semi Transparent, White Colored, Luminescent Spherical Cloud circled directly above my home before disappearing entirely.",12/5/2023,,
Open !,12/3/2023 23:59,Memphis,IN,USA,Light,Unexplained bright shiny light,12/6/2023,Y,
Open,12/3/2023 20:45,Davenport,FL,USA,Orb,"We were swimming, I just so happened to look up and saw strange lights.",12/4/2023,,
Open,12/3/2023 17:40,Sisseton,SD,USA,Circle,"Three circular lights that were dim, and one single circular bright light.",12/3/2023,,
Open,12/2/2023 18:54,New York,NY,USA,Orb,This thing caught my eye as I looked up over the elevated train. I watched it for about 20 minutes making odd turns,12/3/2023,Y,
Open,12/2/2023 17:30,Haverhill,MA,USA,Orb,"Multiple unidentifiable points of lights observed both stationary and traveling in the night sky unlike meteor shower or Starlink, poss",12/7/2023,,
Open,12/2/2023 3:45,Great Falls,MT,USA,Light,5+ white lights circling/maneuvering from our perspective over or beyond Malmstrom Airforce Base,12/2/2023,,
Open,12/1/2023 20:45,,TN,USA,Changing,"Witnesses a changing craft, then 3 small humanoid beings",12/28/2023,,
Open,12/1/2023 10:25,Albion,ME,USA,Unknown,Spotted a Craft this morning.,12/1/2023,,
Open !,11/30/2023 20:25,Denton,NE,USA,Unknown,I observed an aircraft with two bright lights to be stagnant and hovering over my pasture approximately 100' in the air.,12/4/2023,,
Open,11/30/2023 19:00,Buckhead,GA,USA,Light,"Over a period of a couple hours my parents and I watched a distant light in the night sky make small, cyclical movements.",12/16/2023,,
Open,11/30/2023 16:59,Gouverneur,NY,USA,Orb,One orb changing to 4 orbs from left to right 3 times 15 min apart,11/30/2023,,
Open,11/30/2023 12:00,Ponte Vedra Beach,FL,USA,Cigar,"Saw two tictac shaped objects, silent from where I was, swimming backstroke. 3rd object came shortly after.",12/4/2023,,Drone?
